♆⎈FERMENTIS⎈SAFALE BE-134⎈17/01/23⎈17/01/23⎈Paquet 11g sèche⎈66⎈Sèche⎈Ale⎈Basse⎈Lente⎈10⎈18⎈18⎈26⎈26⎈91⎈https://distributors.fermentis.com/download/136/french/1077/safale-be-134_fr.pdf⎈La SafAle™ BE-134 est une Saccharomyces cerevisiae var. diastaticus et est caractérisée par une atténuation très élevée.Cette souche de levure de spécialité a été sélectionnée pour la production de bières de style Saison Belge. Elle favorise la productiond’arômes fruités et épicés (notes de clou de girofle) (POF +). Cette souche permet de brasser des bières rafraîchissantes, avec uneexcellente buvabilité.
♆⎈FERMENTIS⎈SAFALE BE-256⎈17/01/23⎈17/01/23⎈Paquet 11g sèche⎈66⎈Sèche⎈Ale⎈Haute⎈Rapide⎈10⎈18⎈18⎈26⎈26⎈84⎈https://distributors.fermentis.com/download/136/french/731/safale-be-256-fr.pdf⎈Levure sèche active de brasserie recommandée pour la fermentation d’une variété de bières belges de type Abbey connue pour son fruité et son taux élevé d’alcool. Elle fermente très rapidement et révèle de puissants arômes de fermentation. Afin de maintenir le profil aromatique à la fin de la fermentation, nous recommandons de récolter cette levure dès que possible après la fermentation.
♆⎈FERMENTIS⎈SAFALE S-04⎈17/01/23⎈17/01/23⎈Paquet 11g sèche⎈66⎈Sèche⎈Ale⎈Haute⎈Rapide⎈10⎈15⎈15⎈20⎈20⎈78⎈https://distributors.fermentis.com/download/136/french/730/safale-s-04-fr.pdf⎈evure ale anglaise sélectionnée pour sa cinétique fermentaire rapide et sa capacité à former un sédiment compact en fin de fermentation,améliorant ainsi la clarté de la bière. Recommandée pour la production d’une large gamme de bières de haute fermentation etparticulièrement adaptée aux bières re fermentées en fûts ou fermentées en tanks cylindro-coniques.
♆⎈FERMENTIS⎈SAFALE US-05⎈17/01/23⎈17/01/23⎈Paquet 11g sèche⎈66⎈Sèche⎈Ale⎈Moyenne⎈Moyenne⎈10⎈18⎈18⎈26⎈26⎈80⎈https://distributors.fermentis.com/download/136/french/733/safale-us-05-fr.pdf⎈Levure ale américaine permettant de produire des bières aux arômes équilibrés, à faible teneur en diacétyl et aux saveurs fines. Forme unchapeau de mousse ferme et présente une excellente capacité à rester en suspension pendant la fermentation
♆⎈FERMENTIS⎈SAFALE K-97⎈17/01/23⎈17/01/23⎈Paquet 11g sèche⎈66⎈Sèche⎈Ale⎈Basse⎈Lente⎈10⎈15⎈15⎈20⎈26⎈82⎈https://distributors.fermentis.com/download/136/french/732/safale-k-97-fr.pdf⎈Levure de brasserie pour ale allemande qui révèle un caractère de fermentation subtile. Selon les conditions de fermentation, elle tend à présenter un caractère équilibré entre les aspects floraux et fruités. Idéale pour les bières délicates, telles que les bières Kolsch allemandes, les bières Wits belges et certaines versions de bières Session. Adaptée aux bières extrêmement houblonnées et capable de former un grand col de mousse ferme lors de la fermentation.
♆⎈LALLEMAND⎈Test⎈18/01/23⎈18/01/23⎈Paquet 11g sèche⎈67⎈Sèche⎈Ale⎈Basse⎈Lente⎈11⎈16⎈16⎈21⎈27⎈83⎈https://distributors.fermentis.com/download/136/french/732/safale-k-97-fr.pdf⎈Levure de brasserie pour ale allemande qui révèle un caractère de fermentation subtile. Selon les conditions de fermentation, elle tend à présenter un caractère équilibré entre les aspects floraux et fruités. Idéale pour les bières délicates, telles que les bières Kolsch allemandes, les bières Wits belges et certaines versions de bières Session. Adaptée aux bières extrêmement houblonnées et capable de former un grand col de mousse ferme lors de la fermentation.
